{"narrative_markdown":"## Executive Summary\nClio ranks first, Figma second, and Notion third for AI resilience. The spread is partly execution-driven, but it is also category-driven: regulated legal practice management structurally supports higher trust, accountability, switching cost, and workflow dependence than horizontal knowledge work; design collaboration sits between those extremes.\n\nClio is the strongest because it owns system-of-record legal workflow data and high-stakes operational outcomes. Stronger models make Clio more useful because the scarce asset is not raw generation, but governed case context, permissions, billing, calendaring, and accountability. Figma is next because it owns real design-system context and has unusually strong agent-facing surfaces through Dev Mode, Code Connect, APIs, plugins, and MCP support. Notion remains credible and important, but it is the most exposed of the three to generic workspace and agent-layer commoditization unless it deepens system-of-action ownership.\n\nEvidence window: current official company materials accessed April 14, 2026, with emphasis on pricing, developer docs, AI and agent features, integrations, and security or trust materials.\n\n## 2x2 Placement\nAxes used in both the narrative and visual:\n- X-axis: Proprietary Advantage\n- Y-axis: Workflow Criticality + AI Resilience Under Stronger Models\n\n| Company | Placement | Rationale |\n| --- | --- | --- |\n| Clio | Upper-right leader | Clio combines regulated workflow context, daily operational dependence, and real accountability. Its AI is attached to case execution and firm operations rather than a generic chat layer. |\n| Figma | Upper-right, below Clio | Figma owns design-system context and developer handoff in a way that gets better as models improve, but final production accountability still sits outside Figma. |\n| Notion | Right-of-center, below Figma | Notion has broad distribution and strong agent surfaces, but much of its AI value is closer to search, synthesis, and orchestration layers that commodity models and wrappers can reproduce. |\n\n## Full Score Table\n\n### Clio\n| Factor | Score | Rationale |\n| --- | --- | --- |\n| Context | 5 | Direct evidence. Clio Manage, Grow, and Manage AI operate on firm matters, intake, billing, calendars, documents, and client records inside one legal workflow. |\n| Trust | 5 | Direct evidence. Clio emphasizes legal-specific AI principles, bar-association approval, and enterprise security for sensitive legal data. |\n| Distribution | 4 | Direct evidence. Clio sells an end-to-end legal operating stack and exposes 250+ integrations plus APIs into the same buyer. |\n| Judgment | 4 | Direct evidence. Manage AI is aimed at legal tasks such as case summaries, deadline extraction, and bill generation, but lawyers remain the final decision maker. |\n| Liability and governance | 5 | Direct evidence. Legal work needs auditability and compliance; Clio pairs AI use with security controls, regional hosting, and policy commitments. |\n| Proprietary advantage subtotal | 23 | Structural edge comes from regulated context, trust, and legal workflow ownership rather than generic AI UX. |\n| Frequency | 5 | Direct evidence. Practice management, intake, calendaring, billing, and document work are daily firm operations. |\n| Operational dependence | 5 | Inference. Firms running matters, timekeeping, and payments in Clio are materially impaired if the platform is removed. |\n| System position | 5 | Direct evidence. Clio sits as a system of record and system of action for law-firm operations rather than a drafting sidecar. |\n| Switching cost | 5 | Inference. Matter history, client records, workflows, payments, and integrations raise migration pain materially. |\n| Budget durability | 5 | Inference. Core practice-management spend is hard to cut because it is tied to running the firm and collecting revenue. |\n| Workflow criticality subtotal | 25 | This is the deepest operational embed of the three. |\n| Model improvement test | 5 | Inference. Better models make Clio's governed legal context more useful because the platform owns the workflow state the models need. |\n| Wrapper risk test | 5 | Inference. A standalone legal AI wrapper still needs the matter system, permissions, billing, and audit trail that Clio already owns. |\n| Agent readiness test | 4 | Direct evidence. Clio has APIs, OAuth, app-directory distribution, and embedded AI, but its agent surface is less open than Notion's or Figma's. |\n| Accountability test | 5 | Direct evidence. The economic and malpractice risk of being wrong stays inside the legal workflow, where Clio is embedded. |\n| Outcome depth test | 5 | Direct evidence. The product affects deadlines, intake conversion, bill generation, payments, and case execution, not just document drafts. |\n| AI resilience subtotal | 24 | Better models are mostly accretive because Clio owns the workflow and accountability layer. |\n| Total | 72 | Strong resilience. |\n\n### Figma\n| Factor | Score | Rationale |\n| --- | --- | --- |\n| Context | 4 | Direct evidence. Figma stores design files, components, variables, annotations, design systems, and Dev Mode context used in implementation. |\n| Trust | 4 | Direct evidence. Enterprise security, SSO and SCIM, and governance features make Figma a trusted source of design truth, though stakes are lower than legal workflows. |\n| Distribution | 4 | Direct evidence. Figma spans designers, PMs, and developers through design, Dev Mode, VS Code extension, plugins, and community surfaces. |\n| Judgment | 4 | Inference. Good product and systems design still needs human taste, but Figma owns the artifacts and review loops where that judgment is applied. |\n| Liability and governance | 4 | Direct evidence. Governance+, Activity Logs, and Discovery APIs show real admin and compliance depth even if Figma is not the final production authority. |\n| Proprietary advantage subtotal | 20 | Figma has meaningful moat layers, but not the same hard accountability profile as Clio. |\n| Frequency | 5 | Direct evidence. Design iteration, review, and handoff happen continuously in product teams. |\n| Operational dependence | 4 | Inference. Many software teams can operate without Figma only with meaningful collaboration loss and slower handoff. |\n| System position | 4 | Direct evidence. Figma is the design-system and handoff hub, but code, tickets, and production telemetry live elsewhere. |\n| Switching cost | 4 | Inference. Libraries, variables, prototypes, comments, plugins, and habits create notable but not absolute lock-in. |\n| Budget durability | 4 | Inference. Design and dev-collaboration spend is durable for product teams but less non-discretionary than legal operations software. |\n| Workflow criticality subtotal | 21 | High recurring embed, but not the deepest operational dependency in the set. |\n| Model improvement test | 4 | Direct evidence. MCP support, Dev Mode, Make connectors, and Code Connect make better models more useful when grounded in Figma context. |\n| Wrapper risk test | 4 | Inference. Generic design or code wrappers can imitate parts of the surface, but not the collaborative file graph and system context as easily. |\n| Agent readiness test | 5 | Direct evidence. Figma explicitly supports MCP, Code Connect, REST APIs, plugins, variables automation, and developer workflows. |\n| Accountability test | 3 | Inference. Figma influences shipped UI, but final correctness, compliance, and runtime behavior are validated elsewhere. |\n| Outcome depth test | 4 | Direct evidence. Figma sits upstream of shipped product outcomes and design-system consistency, not just inspiration or mockups. |\n| AI resilience subtotal | 20 | Model gains are favorable for Figma, but some generative surface area still commoditizes. |\n| Total | 61 | Strong resilience. |\n\n### Notion\n| Factor | Score | Rationale |\n| --- | --- | --- |\n| Context | 4 | Direct evidence. Notion stores docs, databases, comments, and workspace structure, and Enterprise Search reaches connected apps with citations. |\n| Trust | 3 | Direct evidence. Notion has strong security and permissions, but many high-stakes decisions still require verification in source systems. |\n| Distribution | 5 | Direct evidence. Notion is horizontally distributed across teams as a workspace, API platform, Enterprise Search layer, and AI surface. |\n| Judgment | 3 | Inference. Much of the AI value is synthesis and routing on general models rather than proprietary domain judgment. |\n| Liability and governance | 4 | Direct evidence. Custom Agents security features, audit logs, permissions, and prompt-injection mitigations create meaningful governance. |\n| Proprietary advantage subtotal | 19 | Broad distribution is strong, but proprietary judgment and hard accountability are thinner than Clio's and somewhat thinner than Figma's. |\n| Frequency | 5 | Direct evidence. Teams use docs, project tracking, search, and coordination daily. |\n| Operational dependence | 4 | Inference. Notion is embedded in many recurring workflows, but some organizations can substitute other docs or PM tools over time. |\n| System position | 3 | Direct evidence. Notion is often a coordination layer above the true systems of record even when Enterprise Search connects them. |\n| Switching cost | 3 | Inference. Workspaces can become sticky, but data is comparatively portable and many use cases are template-driven. |\n| Budget durability | 4 | Inference. Knowledge-work software budget is durable, but less protected than legal operating systems and easier to consolidate. |\n| Workflow criticality subtotal | 19 | Recurring usage is strong, but hard operational dependence is mixed. |\n| Model improvement test | 4 | Direct evidence. Enterprise Search, model switching, MCP, and Custom Agents all improve as base models improve. |\n| Wrapper risk test | 2 | Inference. Generic AI workspaces and agent layers can reproduce much of